{"schema_version":1,"generated_at":"2026-07-22T18:01:00Z","revision":"all-actions","refresh_token":"all-actions","counts":{"mail":1,"focus":1,"suggestion":1,"total":3},"rows":[{"schema_version":1,"id":"mail:mail_1","source_kind":"mail","source_id":"mail_1","project":{"peer_id":"peer_hero","display_name":"Hero"},"title":"Mail","timestamp":"2026-07-22T17:00:00Z","activity_at":"2026-07-22T17:00:00Z","group":"mail","unread":true,"availability":"available","revision":0,"actions":[{"id":"mark_read","label":"Mark Read","required_row_revision":0,"requires_idempotency":true},{"id":"acknowledge","label":"Acknowledge","required_row_revision":0,"requires_idempotency":true},{"id":"dismiss","label":"Dismiss","required_row_revision":0,"requires_idempotency":true},{"id":"promote","label":"Promote","required_row_revision":0,"requires_idempotency":true},{"id":"add_to_today","label":"Add to Today","required_row_revision":0,"requires_idempotency":true}]},{"schema_version":1,"id":"focus:focus_1","source_kind":"focus","source_id":"focus_1","project":{"peer_id":"peer_hero","display_name":"Hero"},"title":"Focus","timestamp":"2026-07-22T18:00:00Z","activity_at":"2026-07-22T18:00:00Z","group":"focus","today":true,"availability":"available","revision":2,"actions":[{"id":"launch","label":"Launch","required_row_revision":2,"requires_idempotency":true},{"id":"move_inbox","label":"Move to Inbox","required_row_revision":2,"requires_idempotency":true},{"id":"move_later","label":"Move to Later","required_row_revision":2,"requires_idempotency":true},{"id":"complete","label":"Complete","required_row_revision":2,"requires_idempotency":true}]},{"schema_version":1,"id":"suggestion:suggestion_1","source_kind":"suggestion","source_id":"suggestion_1","project":{"peer_id":"peer_hero","display_name":"Hero"},"title":"Suggestion","timestamp":"2026-07-22T18:00:00Z","activity_at":"2026-07-22T18:00:00Z","group":"suggestion","availability":"available","revision":3,"actions":[{"id":"do_next","label":"Do Next","required_row_revision":3,"requires_idempotency":true},{"id":"today","label":"Today","required_row_revision":3,"requires_idempotency":true},{"id":"later","label":"Later","required_row_revision":3,"requires_idempotency":true},{"id":"dismiss","label":"Dismiss","required_row_revision":3,"requires_idempotency":true}]}]}
