{"schema_version":1,"generated_at":"2026-07-22T18:01:00Z","revision":"snapshot_42","refresh_token":"snapshot_42","counts":{"mail":1,"focus":0,"suggestion":0,"total":1},"rows":[{"schema_version":1,"id":"mail:mail_01JYX","source_kind":"mail","source_id":"mail_01JYX","project":{"peer_id":"peer_hero","registry_slug":"hero","display_name":"Hero"},"title":"Review the inbox contract","summary":"The durable attention contract is ready for review.","body":"The durable attention contract is ready for review.","timestamp":"2026-07-22T18:00:00.123456789Z","activity_at":"2026-07-22T18:00:00.123456789Z","group":"mail","unread":true,"availability":"available","revision":2,"actions":[{"id":"acknowledge","label":"Acknowledge","style":"primary","confirmation":"none","input_schema":{"type":"object"},"required_row_revision":2,"requires_idempotency":true}]}]}
