{"schema_version":1,"generated_at":"2026-07-22T18:01:00Z","revision":"missing-project","refresh_token":"missing-project","counts":{"mail":0,"focus":1,"suggestion":0,"total":1},"rows":[{"schema_version":1,"id":"focus:focus_missing","source_kind":"focus","source_id":"focus_missing","project":{"peer_id":"peer_missing","display_name":"Removed Project"},"title":"Unavailable focus","timestamp":"2026-07-22T18:00:00Z","group":"focus","today":true,"availability":"missing","revision":4,"actions":[{"id":"move_later","label":"Move to Later","required_row_revision":4,"requires_idempotency":true},{"id":"complete","label":"Complete","required_row_revision":4,"requires_idempotency":true}]}]}
